<?xml version="1.0" encoding="UTF-8"?>
<!-- edited with XMLSpy v2008 rel. 2 (http://www.altova.com) by mazuki (darksiderg) -->
<!--W3C Schema generated by XMLSpy v2008 rel. 2 (http://www.altova.com)-->
<xs:schema xmlns:xs="http://www.w3.org/2001/XMLSchema">
	<xs:element name="ECN-Teams">
		<xs:complexType>
			<xs:sequence>
				<xs:element ref="ECN-Team" maxOccurs="6"/>
			</xs:sequence>
		</xs:complexType>
	</xs:element>
	<xs:element name="ECN-Team">
		<xs:complexType>
			<xs:CodeNames.attribute name="name" type="xs:string" use="required"/>
			<xs:CodeNames.attribute name="guessers" type="xs:int" use="required"/>
			<xs:CodeNames.attribute name="definers" type="xs:int" use="required"/>
			<xs:CodeNames.attribute name="cards-count" type="xs:int" use="required"/>
		</xs:complexType>
	</xs:element>
	<xs:element name="ECN-Layout">
		<xs:complexType>
			<xs:CodeNames.attribute name="rows" type="xs:int" use="required"/>
			<xs:CodeNames.attribute name="columns" type="xs:int" use="required"/>
		</xs:complexType>
	</xs:element>
	<xs:element name="ECN-Game">
		<xs:complexType>
			<xs:sequence>
				<xs:element name="ECN-Dictionary-File" type="xs:string"/>
				<xs:element ref="ECN-Board"/>
				<xs:element ref="ECN-Teams"/>
			</xs:sequence>
			<xs:CodeNames.attribute name="name" type="xs:string" use="required"/>
		</xs:complexType>
	</xs:element>
	<xs:element name="ECN-Board">
		<xs:complexType>
			<xs:sequence>
				<xs:element ref="ECN-Layout"/>
			</xs:sequence>
			<xs:CodeNames.attribute name="cards-count" type="xs:int" use="required"/>
			<xs:CodeNames.attribute name="black-cards-count" type="xs:int" use="required"/>
		</xs:complexType>
	</xs:element>
</xs:schema>
